{
  "$schema": "../../manifest.schema.json",
  "manifest_version": 1,
  "schema": "array_homogeneous.cddl",
  "kind": "noncanonical",
  "cases": [
    {
      "id": "array_homogeneous/numbers_indefinite",
      "root": "Numbers",
      "description": "[_ 1, 2, 3]",
      "requirements": ["REQ-RT-180"],
      "derivation": "hand-encoded",
      "variance": "indefinite_length",
      "input": {"cbor": "9f010203ff"},
      "value": {"array": [{"int": "1"}, {"int": "2"}, {"int": "3"}]},
      "cbor": "83010203",
      "json": "[1,2,3]"
    },
    {
      "id": "array_homogeneous/numbers_indefinite_empty",
      "root": "Numbers",
      "description": "[_ ] (RFC 8949 Appendix A)",
      "requirements": ["REQ-RT-180"],
      "derivation": "rfc8949-appendix-a",
      "variance": "indefinite_length",
      "input": {"cbor": "9fff"},
      "value": {"array": []},
      "cbor": "80",
      "json": "[]"
    },
    {
      "id": "array_homogeneous/numbers_one_to_25_indefinite",
      "root": "Numbers",
      "description": "[_ 1..25] (RFC 8949 Appendix A)",
      "requirements": ["REQ-RT-180"],
      "derivation": "rfc8949-appendix-a",
      "variance": "indefinite_length",
      "input": {"cbor": "9f0102030405060708090a0b0c0d0e0f101112131415161718181819ff"},
      "value": {"array": [{"int": "1"}, {"int": "2"}, {"int": "3"}, {"int": "4"}, {"int": "5"}, {"int": "6"}, {"int": "7"}, {"int": "8"}, {"int": "9"}, {"int": "10"}, {"int": "11"}, {"int": "12"}, {"int": "13"}, {"int": "14"}, {"int": "15"}, {"int": "16"}, {"int": "17"}, {"int": "18"}, {"int": "19"}, {"int": "20"}, {"int": "21"}, {"int": "22"}, {"int": "23"}, {"int": "24"}, {"int": "25"}]},
      "cbor": "98190102030405060708090a0b0c0d0e0f101112131415161718181819",
      "json": "[1,2,3,4,5,6,7,8,9,10,11,12,13,14,15,16,17,18,19,20,21,22,23,24,25]"
    },
    {
      "id": "array_homogeneous/numbers_element_head_not_shortest",
      "root": "Numbers",
      "description": "1 written as 18 01",
      "requirements": ["REQ-RT-160", "REQ-RT-180"],
      "derivation": "hand-encoded",
      "variance": "non_shortest_head",
      "input": {"cbor": "8318010203"},
      "value": {"array": [{"int": "1"}, {"int": "2"}, {"int": "3"}]},
      "cbor": "83010203",
      "json": "[1,2,3]"
    },
    {
      "id": "array_homogeneous/numbers_array_head_not_shortest",
      "root": "Numbers",
      "description": "the array header written as 98 03",
      "requirements": ["REQ-RT-160", "REQ-RT-180"],
      "derivation": "hand-encoded",
      "variance": "non_shortest_head",
      "input": {"cbor": "9803010203"},
      "value": {"array": [{"int": "1"}, {"int": "2"}, {"int": "3"}]},
      "cbor": "83010203",
      "json": "[1,2,3]"
    },
    {
      "id": "array_homogeneous/numbers_wide_integer_heads",
      "root": "Numbers",
      "description": "1 and 2 written as 8- and 4-byte arguments",
      "requirements": ["REQ-RT-180"],
      "derivation": "hand-encoded",
      "variance": "non_shortest_head",
      "input": {"cbor": "821b00000000000000011a00000002"},
      "value": {"array": [{"int": "1"}, {"int": "2"}]},
      "cbor": "820102",
      "json": "[1,2]"
    }
  ]
}
